{
  "identity": {
    "unit_id": "L01",
    "slug": "safe-power",
    "kind": "foundation",
    "title": "Power Source and Safe Start",
    "subject_job_sentence": "The power module can provide a chosen low-voltage rail to a breadboard after an adult verifies the setup."
  },
  "pedagogy": {
    "learning_objectives": [
      {
        "statement": "Identify the battery lead, module input, and candidate rail in the official kit reference.",
        "bloom_level": "remember",
        "success_criterion": "I can point to the three places in the disconnected teaching path."
      },
      {
        "statement": "Explain why every connection stays open while I trace the possible power path.",
        "bloom_level": "understand",
        "success_criterion": "I can explain why I move parts only while the battery lead is disconnected."
      },
      {
        "statement": "Trace a possible power path and record each location on an evidence card.",
        "bloom_level": "apply",
        "success_criterion": "I can trace the teaching path and complete the evidence card in order."
      }
    ],
    "prior_knowledge": {
      "prerequisite_labs": [],
      "assumed_ideas": [],
      "retrieval_prompt": "Without looking at the page, name one thing you already do before touching an electrical device."
    },
    "misconceptions": [
      {
        "misconception": "A coloured breadboard rail always has a fixed electrical job.",
        "why_it_is_common": "The coloured lines look like permanent instructions even when nothing has been connected or verified.",
        "confronted_by": "The disconnected path map calls it a candidate output location and requires an adult check before later use."
      }
    ],
    "vocabulary": [
      {
        "term": "rail",
        "child_definition": "A long group of joined breadboard holes that may share one electrical connection.",
        "introduced_in": "explore"
      },
      {
        "term": "circuit",
        "child_definition": "A complete loop with a path out from a source and a path back to it.",
        "introduced_in": "explain"
      }
    ],
    "scaffolding": {
      "adult_does": [
        "Place the disconnected kit parts beside the official reference photograph.",
        "Confirm that the battery lead remains physically disconnected throughout the activity.",
        "Verify the module and candidate rail before signing the evidence card."
      ],
      "child_does": [
        "Match each visible kit part to the official reference photograph.",
        "Trace the three-location teaching path with a finger.",
        "Tick each evidence-card statement only after pointing to the matching place."
      ],
      "fading_note": "Because this is the first lab, the adult models the safety check; later labs ask the child to initiate the same power-off check."
    },
    "cognitive_load": {
      "segments": [
        "Notice the disconnected parts",
        "Make a prediction",
        "Match three locations",
        "Trace the open path",
        "Complete the evidence card",
        "Ask for adult signoff"
      ],
      "concrete_before_abstract": "The child first points to the physical battery lead, module, and breadboard before meeting the word circuit.",
      "worked_example": "The adult points to the source lead end in the photograph, finds the same end on the table, and ticks only that first item."
    }
  },
  "sequence": {
    "engage": {
      "hook": "Three objects can belong to one possible power path even while every connection is safely open on the table.",
      "eliciting_question": "What do you think the coloured line beside a breadboard rail tells you?"
    },
    "explore": {
      "predict": {
        "question": "Which location do you think comes between the battery lead and a candidate breadboard rail?",
        "options": [
          "module DC input",
          "any coloured rail",
          "the Arduino USB socket"
        ],
        "recorded_before_observing": true
      },
      "observe": {
        "what_to_observe": "Compare the official photograph, the disconnected parts, and the three labelled locations on the path map.",
        "record_method": "tick_or_circle",
        "evidence_fields": [
          "prediction",
          "source lead end",
          "module DC input",
          "candidate output label",
          "disconnected check"
        ]
      },
      "steps": [
        {
          "number": 1,
          "action": "Check with the adult that the battery lead is physically disconnected."
        },
        {
          "number": 2,
          "action": "Circle your predicted middle location before looking at the path map."
        },
        {
          "number": 3,
          "action": "Find the battery and DC lead in the official kit photograph."
        },
        {
          "number": 4,
          "action": "Point to the source lead end on the disconnected part."
        },
        {
          "number": 5,
          "action": "Point to the module DC input without inserting the lead."
        },
        {
          "number": 6,
          "action": "Point to one labelled candidate output location without moving a selector."
        },
        {
          "number": 7,
          "action": "Trace the three dashed teaching links on the path map with a finger."
        },
        {
          "number": 8,
          "action": "Tick each place found and ask the adult to verify the card."
        }
      ],
      "expected_observation": "The three locations form an ordered teaching path, but visible gaps remain because nothing is connected.",
      "not_yet_outcome": {
        "symptom": "One location cannot be matched confidently between the reference and the real parts.",
        "first_check": "Keep everything disconnected and ask the adult to repeat the photograph-to-part match."
      }
    },
    "explain": {
      "what_you_saw": "You found three different locations and traced their order while the source lead remained separated from the module.",
      "why_it_happened": "The battery and DC lead, the module, and the breadboard rail have different jobs. In later verified work, a source can feed a module and the module can feed a selected rail. Electricity needs a complete circuit: a path out from one source terminal, through the parts, and back to the other source terminal. Today the lead stays disconnected, so the path is deliberately open and no current can follow it. A rail colour is only a visual label; an adult must verify the physical map and selector setting before that rail is assigned a job.",
      "self_explanation_prompt": "Tell the adult why the coloured rail line alone cannot prove what the rail will do."
    },
    "elaborate": {
      "near_transfer": [
        "With the parts still disconnected, start at the candidate rail and trace the same teaching path backward."
      ],
      "far_transfer": [
        "A battery-powered toy also needs a complete path before energy can reach its motor.",
        "A flashlight remains off when its switch leaves an open gap in the circuit."
      ]
    },
    "evaluate": {
      "success_criteria_checklist": [
        "I can point to the three places in the disconnected teaching path.",
        "I can explain why I move parts only while the battery lead is disconnected.",
        "I can trace the teaching path and complete the evidence card in order."
      ],
      "hinge_question": {
        "question": "If a rail has a red line but no verified connection, what electrical job does the colour prove?",
        "reveals": "The answer reveals whether the learner treats a visual label as evidence of an electrical connection."
      },
      "next_lab_link": "L02 reuses the habit of checking the power state before the child handles a new component."
    }
  },
  "content": {
    "identification": {
      "child_name": "breadboard power module",
      "technical_name": "breadboard power-supply module",
      "distinguishing_features": "A small module in the official kit that sits between a DC source lead and a breadboard power rail in the teaching path.",
      "orientation_cue": "Do not infer placement from shape alone; an adult verifies the module against the supplied path map.",
      "parts": [
        {
          "label": "9 V battery and DC lead",
          "role": "The disconnected source item named by the official kit listing."
        },
        {
          "label": "module DC input",
          "role": "The middle location on the unpowered teaching path."
        },
        {
          "label": "candidate output label",
          "role": "A location to identify before an adult assigns any later electrical job."
        },
        {
          "label": "breadboard rail",
          "role": "A long group of joined holes whose use must be verified."
        }
      ]
    },
    "troubleshooting": [
      {
        "what_you_notice": "The real part does not look exactly like the enlarged path-map symbol.",
        "likely_reason": "The path map teaches location and order rather than photographic appearance.",
        "safe_first_check": "Keep the lead disconnected and compare the real part with the official reference photograph."
      },
      {
        "what_you_notice": "You are unsure which labelled output location to record.",
        "likely_reason": "A colour or nearby marking was mistaken for a verified connection.",
        "safe_first_check": "Do not move a selector; ask the adult to verify the candidate label on the map."
      }
    ],
    "sourced_claims": [
      {
        "claim": "The supply this activity identifies is the kit's included 9 V battery with a DC connector.",
        "source_locator": {
          "path": "inputs/kit_calibration.v1.yaml",
          "section_or_line": "Included 9 V battery with DC connector"
        },
        "subject_scope": {
          "exact_model": "kit_battery_9v"
        },